idDBLP,title,authors,venue,year,Row_IDconf/sigmod/BohannonDGKLNS03,ROLEX: Relational On-Line Exchange with XML,"P Bohannon, X Dong, S Ganguly, H Korth, C Li, P Narayan, P Shenoy",SIGMOD Conference,2003,417journals/sigmod/ShethBS99,VideoAnywhere: A System for Searching and Managing Distributed Video Assets,"A Sheth, C Bertram, K Shah",SIGMOD Record,1999,418journals/sigmod/SnodgrassACFLLORRSV99,Reminiscences on Influential Papers,N/A,N/A,1999,419conf/sigmod/ZhuSZ03,Query by Humming - in Action with its Technology Revealed,"Y Zhu, D Shasha, X Zhao",SIGMOD Conference,2003,420conf/sigmod/ZhangDWEMPMDR03,Rainbow: Multi-XQuery Optimization Using Materialized XML Views,"X Zhang, K Dimitrova, L Wang, M El-Sayed, B Murphy, B Pielech, M Mulchandani, L Ding, E Rundensteiner",SIGMOD Conference,2003,421journals/sigmod/NascimentoM99,Report on the 13th Brazilian Symposium on Database Systems (SBBD'98),N/A,N/A,1999,422conf/sigmod/PaparizosACJLNPSWWY03,TIMBER: A Native System for Querying XML,"S Paparizos, S Al-Khalifa, A Chapman, H Jagadish, L Lakshmanan, A Nierman, J Patel, D Srivastava, N Wiwatwattana, Y Wu, C Yu",SIGMOD Conference,2003,423journals/sigmod/RoantreeMH99,The OASIS Multidatabase Prototype,"M Roantree, J Murphy, W Hasselbring",SIGMOD Record,1999,424conf/sigmod/ChoALS03,LockX: A System for Efficiently Querying Secure XML,"S Cho, S Amer-Yahia, L Lakshmanan, D Srivastava",SIGMOD Conference,2003,425journals/sigmod/Franklin98b,Editor's Notes,M Franklin,SIGMOD Record,1998,426journals/sigmod/Danish98,Building Database-driven Electronic Catalogs,S Danish,SIGMOD Record,1998,427conf/sigmod/ZhouWGGZWXYF03,TREX: DTD-Conforming XML to XML Transformations,"A Zhou, Q Wang, Z Guo, X Gong, S Zheng, H Wu, J Xiao, K Yue, W Fan",SIGMOD Conference,2003,428journals/sigmod/CareyS99,NSF Workshop on Industrial/Academic Cooperation in Database Systems,N/A,N/A,1999,429conf/sigmod/DeshpandeNGS03a,IrisNet: Internet-scale Resource-Intensive Sensor Services,"A Deshpande, S Nath, P Gibbons, S Seshan",SIGMOD Conference,2003,430journals/sigmod/EisenbergM99,"SQL: 1999, formerly known as SQL 3","A Eisenberg, J Melton",SIGMOD Record,1999,431conf/sigmod/ChandrasekaranCDFHHKMRS03,TelegraphCQ: Continuous Dataflow Processing,"S Chandrasekaran, O Cooper, A Deshpande, M Franklin, J Hellerstein, W Hong, S Krishnamurthy, S Madden, F Reiss, M Shah",SIGMOD Conference,2003,432journals/sigmod/Mackay99,Semantic Integration of Environmental Models for Application to Global Information Systems and Decision-Making,D Mackay,SIGMOD Record,1999,433conf/sigmod/Amer-YahiaFSX03,PIX: Exact and Approximate Phrase Matching in XML,"S Amer-Yahia, M Fernandez, D Srivastava, Y Xu",SIGMOD Conference,2003,434conf/sigmod/ArasuBBDIRW03,STREAM: The Stanford Stream Data Manager,"A Arasu, B Babcock, S Babu, M Datar, K Ito, I Nishizawa, J Rosenstein, J Widom",SIGMOD Conference,2003,435journals/sigmod/ForteHWDCVHFS99,Semantic and Pedagogic Interoperability Mechanisms in the ARIADNE Educational Repository,"E Forte, F Haenni, K Warkentyne, E Duval, K Cardinaels, E Vervaet, K Hendrikx, M Forte, F Simillion",SIGMOD Record,1999,436journals/sigmod/Hanson99,Statement from the Treasurer,E Hanson,SIGMOD Record,1999,437conf/sigmod/LarsonG03,Transparent Mid-Tier Database Caching in SQL Server,"P Larson, J Goldstein, J Zhou",SIGMOD Conference,2003,438journals/sigmod/OukselS99,Semantic Interoperability in Global Information Systems: A Brief Introduction to the Research Area and the Special Section,"A Ouksel, A Sheth",SIGMOD Record,1999,439conf/sigmod/AgichteinG03,QXtract: A Building Block for Efficient Information Extraction from Plain-Text Databases,"E Agichtein, L Gravano",SIGMOD Conference,2003,440conf/sigmod/OoiTZGLLLNSWZ03,PeerDB: Peering into Personal Databases,"B Ooi, K Tan, A Zhou, C Goh, Y Li, C Liau, B Ling, W Ng, Y Shu, X Wang, M Zhang",SIGMOD Conference,2003,441journals/sigmod/BergamaschiCV99,Semantic Integration of Semistructured and Structured Data Sources,"S Bergamaschi, S Castano, M Vincini",SIGMOD Record,1999,442conf/sigmod/LiuFP03,GridDB: A Database Interface to the Grid,"D Liu, M Franklin, D Parekh",SIGMOD Conference,2003,443journals/sigmod/Gal99,Semantic Interoperability in Information Services: Experiencing with CoopWARE,A Gal,SIGMOD Record,1999,444journals/sigmod/SmithO99,Unpacking The Semantics of Source and Usage To Perform Semantic Reconciliation In Large-Scale Information Systems,"K Smith, L Obrst",SIGMOD Record,1999,445conf/sigmod/ZuzartePMCLW03,WinMagic : Subquery Elimination Using Window Aggregation,"C Zuzarte, H Pirahesh, W Ma, Q Cheng, L Liu, K Wong",SIGMOD Conference,2003,446conf/sigmod/LakshmananPZ03a,SOCQET: Semantic OLAP with Compressed Cube and Summarization,"L Lakshmanan, J Pei, Y Zhao",SIGMOD Conference,2003,447journals/sigmod/Hampapur99,Semantic Video Indexing: Approach and Issue,A Hampapur,SIGMOD Record,1999,448conf/sigmod/ShashaB02,"Database tuning: principles, experiments, and troubleshooting techniques (part II)","D Shasha, P Bonnet",SIGMOD Conference,2002,449journals/sigmod/SycaraKWL99,Dynamic Service Matchmaking Among Agents in Open Information Environments,"K Sycara, M Klusch, S Widoff, J Lu",SIGMOD Record,1999,450conf/sigmod/ShashaB02a,"Database tuning: principles, experiments, and troubleshooting techniques (part I)","D Shasha, P Bonnet",SIGMOD Conference,2002,451journals/sigmod/PapazoglouH99,Contextualizing the Information Space in Federated Digital Libraries,"M Papazoglou, J Hoppenbrouwers",SIGMOD Record,1999,452journals/sigmod/SouzaS99,Efficient Materialization and Use of Views in Data Warehouses,"M Souza, M Sampaio",SIGMOD Record,1999,453conf/sigmod/ViglasN02,Rate-based query optimization for streaming information sources,"S Viglas, J Naughton",SIGMOD Conference,2002,454conf/sigmod/2002,"Proceedings of the 2002 ACM SIGMOD International Conference on Management of Data, Madison, Wisconsin, June 3-6, 2002",N/A,N/A,2002,455journals/sigmod/FowlerPNB99,Agent-Based Semantic Interoperability in InfoSleuth,"J Fowler, B Perry, M Nodine, B Bargmeyer",SIGMOD Record,1999,456journals/sigmod/KuanL99,A Study on Data Point Search for HG-Trees,"J Kuan, P Lewis",SIGMOD Record,1999,457conf/sigmod/HinneburgKW02,HD-Eye: visual clustering of high dimensional data,"A Hinneburg, D Keim, M Wawryniuk",SIGMOD Conference,2002,458journals/sigmod/CeriFP99,Design Principles for Data-Intensive Web Sites,"S Ceri, P Fraternali, S Paraboschi",SIGMOD Record,1999,459conf/sigmod/PhanN02,GEA: a toolkit for gene expression analysis,"J Phan, R Ng",SIGMOD Conference,2002,460journals/sigmod/Snodgrass99,Chair's Message,N/A,N/A,1999,461conf/sigmod/Bonnet02,Going public: open-source databases and database research,P Bonnet,SIGMOD Conference,2002,462journals/sigmod/Kim99,"Message from Editor-in-Chief, ACM Transactions on Database Systems",W Kim,N/A,1999,463conf/sigmod/HellersteinW02,Data streams: fresh current or stagnant backwater? (panel),"J Hellerstein, J Widom",SIGMOD Conference,2002,464journals/sigmod/GruenwaldBDGSSV99,Database Research at the University of Oklahoma,"L Gruenwald, L Brown, R Dirckze, S Guinepain, C Sánchez, B Summers, S Vanichayobon",SIGMOD Record,1999,465conf/sigmod/CranorGJSS02,Gigascope: high performance network monitoring with an SQL interface,"C Cranor, Y Gao, T Johnson, V Shkapenyuk, O Spatscheck",SIGMOD Conference,2002,466journals/sigmod/DomenigD99,An Overview and Classification of Mediated Query Systems,"R Domenig, K Dittrich",SIGMOD Record,1999,467conf/sigmod/MaddenH02,Distributing queries over low-power wireless sensor networks,"S Madden, J Hellerstein",SIGMOD Conference,2002,468conf/sigmod/AgrawalCD02,DBXplorer: enabling keyword search over relational databases,"S Agrawal, S Chaudhuri, G Das",SIGMOD Conference,2002,469journals/sigmod/Snodgrass99a,Chair's Message,N/A,N/A,1999,470journals/sigmod/Ozsoyoglu99,Vice Chair's Message,N/A,N/A,1999,471conf/sigmod/HanWDPW02,CubeExplorer: online exploration of data cubes,"J Han, J Wang, G Dong, J Pei, K Wang",SIGMOD Conference,2002,472conf/sigmod/KarbhariRXD02,ACDN: a content delivery network for applications,"P Karbhari, M Rabinovich, Z Xiao, F Douglis",SIGMOD Conference,2002,473journals/sigmod/YauLMS99,On Multi-Resolution Document Transmission in Mobile Web,"S Yau, H Leong, D McLeod, A Si",SIGMOD Record,1999,474conf/sigmod/AltinelLKMPLWB02,DBCache: database caching for web application servers,"M Altinel, Q Luo, S Krishnamurthy, C Mohan, H Pirahesh, B Lindsay, H Woo, L Brown",SIGMOD Conference,2002,475journals/sigmod/BernsteinDK99,"Towards Adaptive Workflow Systems, CSCW-98 Workshop Report",N/A,N/A,1999,476conf/sigmod/FungSG02,COUGAR: the network is the database,"W Fung, D Sun, J Gehrke",SIGMOD Conference,2002,477journals/sigmod/Franklin99,Editor's Notes,M Franklin,SIGMOD Record,1999,478conf/sigmod/WangTYGWP02,"COMMIX: towards effective web information extraction, integration and query answering","T Wang, S Tang, D Yang, J Gao, Y Wu, J Pei",SIGMOD Conference,2002,479journals/sigmod/Snodgrass99b,Reminiscences on Influential Papers,N/A,N/A,1999,480conf/sigmod/DogacTPPLKTK02,An ebXML infrastructure implementation through UDDI registries and RosettaNet PIPs,"A Dogac, Y Tambag, P Pembecioglu, S Pektas, G Laleci, G Kurt, S Toprak, Y Kabak",SIGMOD Conference,2002,481journals/sigmod/CfP99,"The Active Database Central, ER2000, VLDB 2000, WISE 2000, Books, ACM DL",N/A,SIGMOD Record,1999,482conf/sigmod/BumbulisB02,A compact B-tree,"P Bumbulis, I Bowman",SIGMOD Conference,2002,483journals/sigmod/Franklin99a,Editor's Notes,M Franklin,SIGMOD Record,1999,484conf/sigmod/Weininger02,Efficient execution of joins in a star schema,A Weininger,SIGMOD Conference,2002,485journals/sigmod/ConradHHKRSS99,Engineering Federated Information Systems: Report of EFIS '99 Workshop,"S Conrad, W Hasselbring, U Hohenstein, R Kutsche, M Roantree, G Saake, F Saltor",SIGMOD Record,1999,486journals/sigmod/FrankGGJKLMNPSSSTW99,Chorochronos: A Research Network for Spatiotemporal Database Systems,"A Frank, S Grumbach, R Güting, C Jensen, M Koubarakis, N Lorentzos, Y Manolopoulos, E Nardelli, B Pernici, H Schek, M Scholl, T Sellis, B Theodoulidis, P Widmayer",SIGMOD Record,1999,487conf/sigmod/RaoZML02,Automating physical database design in a parallel database,"J Rao, C Zhang, N Megiddo, G Lohman",SIGMOD Conference,2002,488journals/sigmod/BoulosO99,Cost Estimation of User-Defined Methods in Object-Relational Database Systems,"J Boulos, K Ono",SIGMOD Record,1999,489conf/sigmod/Aggarwal02,"Hierarchical subspace sampling: a unified framework for high dimensional data reduction, selectivity estimation and nearest neighbor search",C Aggarwal,SIGMOD Conference,2002,490journals/sigmod/RosenthalS99,First-Class Views: A Key to User-Centered Computing,"A Rosenthal, E Sciore",SIGMOD Record,1999,491conf/sigmod/SismanisDRK02,Dwarf: shrinking the PetaCube,"Y Sismanis, A Deligiannakis, N Roussopoulos, Y Kotidis",SIGMOD Conference,2002,492journals/sigmod/RamDD99,Distributed Transactions in Practice,"P Ram, L Do, P Drew",SIGMOD Record,1999,493conf/sigmod/ChaudhuriGN02,Compressing SQL workloads,"S Chaudhuri, A Gupta, V Narasayya",SIGMOD Conference,2002,494journals/sigmod/PapianiWDN99,"A Distributed Scientific Data Archive Using the Web, XML and SQL/MED","M Papiani, J Wason, A Dunlop, D Nicole",SIGMOD Record,1999,495conf/sigmod/BhattacharyaMBNHS02,Coordinating backup/recovery and data consistency between database and file systems,"S Bhattacharya, C Mohan, K Brannon, I Narang, H Hsiao, M Subramanian",SIGMOD Conference,2002,496journals/sigmod/Etzion99,Report on NGITS'99: The 4th International Workshop on Next Generation Information Technologies and Systems,N/A,N/A,1999,497conf/sigmod/MoonWH02,General match: a subsequence matching method in time-series databases based on generalized windows,"Y Moon, K Whang, W Han",SIGMOD Conference,2002,498conf/sigmod/WangWYY02,Clustering by pattern similarity in large data sets,"H Wang, W Wang, J Yang, P Yu",SIGMOD Conference,2002,499journals/sigmod/HansonN99,Timer-Driven Database Triggers and Alerters: Semantics and a Challenge,"E Hanson, L Noronha",SIGMOD Record,1999,500journals/sigmod/Libkin99,"Some Remarks on Variable Independence, Closure, and Orthographic Dimension in Constraint Databases",L Libkin,SIGMOD Record,1999,501conf/sigmod/ProcopiucJAM02,A Monte Carlo algorithm for fast projective clustering,"C Procopiuc, M Jones, P Agarwal, T Murali",SIGMOD Conference,2002,502conf/sigmod/ThaperGIK02,Dynamic multidimensional histograms,"N Thaper, S Guha, P Indyk, N Koudas",SIGMOD Conference,2002,503journals/sigmod/Libkin99a,Database Principles Column - Introduction,L Libkin,SIGMOD Record,1999,504conf/sigmod/BrunoC02,Exploiting statistics on query expressions for optimization,"N Bruno, S Chaudhuri",SIGMOD Conference,2002,505journals/sigmod/Abiteboul99,On Views and XML,S Abiteboul,SIGMOD Record,1999,506conf/sigmod/Ramanan02,Efficient algorithms for minimizing tree pattern queries,P Ramanan,SIGMOD Conference,2002,507journals/sigmod/RossCGJBV99,Reminiscences on Influential Papers,N/A,N/A,1999,508conf/sigmod/VriesMNK02,Efficient k-NN search on vertically decomposed data,"A Vries, N Mamoulis, N Nes, M Kersten",SIGMOD Conference,2002,509journals/sigmod/MusickC99,Practical Lessons in Supporting Large-Scale Computational Science,"R Musick, T Critchlow",SIGMOD Record,1999,510conf/sigmod/GaoW02,Continually evaluating similarity-based pattern queries on a streaming time series,"L Gao, X Wang",SIGMOD Conference,2002,511journals/sigmod/EisenbergM99a,SQLJ-Part 1: SQL Routines Using the Java Programming Language,"A Eisenberg, J Melton",SIGMOD Record,1999,512conf/sigmod/DattaDTVSR02,Proxy-based acceleration of dynamically generated content on the world wide web: an approach and implementation,"A Datta, K Dutta, H Thomas, D VanderMeer, S Suresha, K Ramamritham",SIGMOD Conference,2002,513journals/sigmod/McHughW97,Integrating Dynamically-Fetched External Information into a DBMS for Semistructured Data,"J McHugh, J Widom",SIGMOD Record,1997,514journals/sigmod/AtzeniMM97,Semistructured und Structured Data in the Web: Going Back and Forth,"P Atzeni, G Mecca, P Merialdo",SIGMOD Record,1997,515conf/sigmod/DobraGGR02,Processing complex aggregate queries over data streams,"A Dobra, M Garofalakis, J Gehrke, R Rastogi",SIGMOD Conference,2002,516conf/sigmod/ChenGMV02,Fractal prefetching B±Trees: optimizing both cache and disk performance,"S Chen, P Gibbons, T Mowry, G Valentin",SIGMOD Conference,2002,517journals/sigmod/BaaderJN97,Intelligent Access to Heterogeneous Information Sources: Report on the 4th Workshop on Knowledge Representation Meets Databases,N/A,N/A,1997,518conf/sigmod/ZhouR02,Implementing database operations using SIMD instructions,"J Zhou, K Ross",SIGMOD Conference,2002,519journals/sigmod/NestorovAM97,Infering Structure in Semistructured Data,"S Nestorov, S Abiteboul, R Motwani",SIGMOD Record,1997,520journals/sigmod/Snodgrass97a,Chair's Message,N/A,N/A,1997,521conf/sigmod/FreireHRRS02,StatiX: making XML count,"J Freire, J Haritsa, M Ramanath, P Roy, J Siméon",SIGMOD Conference,2002,522journals/sigmod/NadoH97,Extracting Entity Profiles from Semistructured Information Spaces,"R Nado, S Huffman",SIGMOD Record,1997,523conf/sigmod/LiGS02,Skew handling techniques in sort-merge join,"W Li, D Gao, R Snodgrass",SIGMOD Conference,2002,524journals/sigmod/AshishK97,Wrapper Generation for Semi-structured Internet Sources,"N Ashish, C Knoblock",SIGMOD Record,1997,525conf/sigmod/TatarinovVBSSZ02,Storing and querying ordered XML using a relational database system,"I Tatarinov, S Viglas, K Beyer, J Shanmugasundaram, E Shekita, C Zhang",SIGMOD Conference,2002,526conf/sigmod/PapakonstantinouPV02,QURSED: querying and reporting semistructured data,"Y Papakonstantinou, M Petropoulos, V Vassalos",SIGMOD Conference,2002,527journals/sigmod/Suciu97,Foreword: Management of Semistructured Data,N/A,N/A,1997,528journals/sigmod/JajodiaBBKMSW97,Information Systems Research at George Mason University,"S Jajodia, D Barbará, A Brodsky, L Kerschberg, A Motro, E Sibley, X Wang",SIGMOD Record,1997,529conf/sigmod/DasuJMS02,"\Mining database structure; or, how to build a data quality browser\""""","T Dasu, T Johnson, S Muthukrishnan, V Shkapenyuk",SIGMOD Conference,2002,530journals/sigmod/GrayG97,"The Five-Minute Rule Ten Years Later, and Other Computer Storage Rules of Thumb","J Gray, G Graefe",SIGMOD Record,1997,531conf/sigmod/GillmannWW02,Workflow management with service quality guarantees,"M Gillmann, G Weikum, W Wonner",SIGMOD Conference,2002,532conf/sigmod/GuhaJKSY02,Approximate XML joins,"S Guha, H Jagadish, N Koudas, D Srivastava, T Yu",SIGMOD Conference,2002,533journals/sigmod/Franklin97a,Editor's Notes,M Franklin,SIGMOD Record,1997,534journals/sigmod/DadamK97,The Database and Information System Research Group at the University of Ulm,"P Dadam, W Klas",SIGMOD Record,1997,535conf/sigmod/RamanH02,Partial results for online query processing,"V Raman, J Hellerstein",SIGMOD Conference,2002,536conf/sigmod/TaoP02,Time-parameterized queries in spatio-temporal databases,"Y Tao, D Papadias",SIGMOD Conference,2002,537journals/sigmod/ConradEHRSSSV97,Research Issues in Federated Database Systems: Report of EFDBS '97 Workshop,N/A,N/A,1997,538conf/sigmod/BrunoKS02,Holistic twig joins: optimal XML pattern matching,"N Bruno, N Koudas, D Srivastava",SIGMOD Conference,2002,539journals/sigmod/McClatcheyV97,Workshop on Workflow Management in Scientific and Engineering Applications - Report,N/A,N/A,1997,540conf/sigmod/PolyzotisG02,Statistical synopses for graph-structured XML databases,"N Polyzotis, M Garofalakis",SIGMOD Conference,2002,541journals/sigmod/Seligman97,Industry Perspectives,L Seligman,SIGMOD Record,1997,542journals/sigmod/GuptaHR97,Virtual Database technology,"A Gupta, V Harinarayan, A Rajaraman",SIGMOD Record,1997,543conf/sigmod/ChangH02,Minimal probing: supporting expensive predicates for top-k queries,"K Chang, S Hwang",SIGMOD Conference,2002,544journals/sigmod/Snodgrass97,Chair's Message,N/A,N/A,1997,545conf/sigmod/YangWYH02,Mining long sequential patterns in a noisy environment,"J Yang, W Wang, P Yu, J Han",SIGMOD Conference,2002,546journals/sigmod/BarbaraS97,Quasi-Cubes: Exploiting Approximations in Multidimensional Databases,"D Barbará, M Sullivan",SIGMOD Record,1997,547conf/sigmod/ChoiC02,Selectivity estimation for spatio-temporal queries to moving objects,"Y Choi, C Chung",SIGMOD Conference,2002,548journals/sigmod/ClementLGMK97,OGDI: Toward Interoperability among Geospatial Databases,"G Clement, C Larouche, D Gouin, P Morin, H Kucera",SIGMOD Record,1997,549conf/sigmod/GarofalakisG02,Wavelet synopses with error guarantees,"M Garofalakis, P Gibbons",SIGMOD Conference,2002,550conf/sigmod/JosifovskiSHL02,Garlic: a new flavor of federated query processing for DB2,"V Josifovski, P Schwarz, L Haas, E Lin",SIGMOD Conference,2002,551journals/sigmod/RamamrithamS97,Report on DART '96: Databases: Active and Real-Time (Concepts meet Practice),N/A,N/A,1997,552conf/sigmod/KanthRA02,Quadtree and R-tree indexes in oracle spatial: a comparison using GIS data,"K Kanth, S Ravada, D Abugov",SIGMOD Conference,2002,553journals/sigmod/FernandezFLS97,A Query Language for a Web-Site Management System,"M Fernandez, D Florescu, A Levy, D Suciu",SIGMOD Record,1997,554journals/sigmod/HadzilacosT97,An Extended Entity-Relationship Model for Geographic Applications,"T Hadzilacos, N Tryfona",SIGMOD Record,1997,555conf/sigmod/SzalayGTKMRSv02,The SDSS skyserver: public access to the sloan digital sky server data,"A Szalay, J Gray, A Thakar, P Kunszt, T Malik, J Raddick, C Stoughton, J vandenBerg",SIGMOD Conference,2002,556conf/sigmod/PossSKL02,"TPC-DS, taking decision support benchmarking to the next level","M Pöss, B Smith, L Kollár, P Larson",SIGMOD Conference,2002,557journals/sigmod/JukicV97,Asserting Beliefs in MLS Relational Models,"N Jukic, S Vrbsky",SIGMOD Record,1997,558journals/sigmod/SilberschatzZ97,Database Systems - Breaking Out of the Box,"A Silberschatz, S Zdonik",SIGMOD Record,1997,559conf/sigmod/Team02,Mid-tier caching: the TimesTen approach,T Team,SIGMOD Conference,2002,560conf/sigmod/AntonJLPZZ02,Web caching for database applications with Oracle Web Cache,"J Anton, L Jacobs, X Liu, J Parker, Z Zeng, T Zhong",SIGMOD Conference,2002,561journals/sigmod/Fong97,Converting Relational to Object-Oriented Databases,J Fong,SIGMOD Record,1997,562journals/sigmod/RamanathanH97,Extraction of Object-Oriented Structures from Existing Relational Databases,"S Ramanathan, J Hodges",SIGMOD Record,1997,563conf/sigmod/LuoKMPWLN02,Middle-tier database caching for e-business,"Q Luo, S Krishnamurthy, C Mohan, H Pirahesh, H Woo, B Lindsay, J Naughton",SIGMOD Conference,2002,564conf/sigmod/MarklL02,Learning table access cardinalities with LEO,"V Markl, G Lohman",SIGMOD Conference,2002,565journals/sigmod/ChaudhuriD97,An Overview of Data Warehousing and OLAP Technology,"S Chaudhuri, U Dayal",SIGMOD Record,1997,566conf/sigmod/ZhangMCMR02,Rainbow: mapping-driven XQuery processing system,"X Zhang, M Mulchandani, S Christ, B Murphy, E Rundensteiner",SIGMOD Conference,2002,567journals/sigmod/Franklin97,Editor's Notes,N/A,N/A,1997,568conf/sigmod/TheobaldW02,The XXL search engine: ranked retrieval of XML data using indexes and ontologies,"A Theobald, G Weikum",SIGMOD Conference,2002,569journals/sigmod/McHughAGQW97,Lore: A Database Management System for Semistructured Data,"J McHugh, S Abiteboul, R Goldman, D Quass, J Widom",SIGMOD Record,1997,570journals/sigmod/Konig-RiesL97,"Research in Databases and Data-Intensive Applications - Computer Science Department and FZI, University of Karlsruhe","B König-Ries, P Lockemann",SIGMOD Record,1997,571conf/sigmod/BarbosaMKL02,ToXgene: a template-based data generator for XML,"D Barbosa, A Mendelzon, J Keenleyside, K Lyons",SIGMOD Conference,2002,572conf/sigmod/AbadiC02,Visual COKO: a debugger for query optimizer development,"D Abadi, M Cherniack",SIGMOD Conference,2002,573journals/sigmod/FrewD97,Data Management for Earth System Science,"J Frew, J Dozier",SIGMOD Record,1997,574conf/sigmod/ChenRW02,XCache: a semantic caching system for XML queries,"L Chen, E Rundensteiner, S Wang",SIGMOD Conference,2002,575journals/sigmod/RosenthalHRS97,"\A Consumer Viewpoint on \""\""Mediator Languages - a Proposal for a Standard\""\""\""""","A Rosenthal, E Hughes, S Renner, L Seligman",SIGMOD Record,1997,576conf/sigmod/RundensteinerWYD02,XmdvTool: visual interactive data exploration and trend discovery of high-dimensional data sets,"E Rundensteiner, M Ward, J Yang, P Doshi",SIGMOD Conference,2002,577journals/sigmod/AtzeniM98,WebDB '98: International Workshop on the Web and Databases,N/A,N/A,1998,578conf/sigmod/LuWYBLY02,XBase: making your gigabyte disk queriable,"H Lu, G Wang, G Yu, Y Bao, J Lv, Y Yu",SIGMOD Conference,2002,579journals/sigmod/Snodgrass98b,Chair's Message,N/A,N/A,1998,580journals/sigmod/ChangGKRS98,Database Research at Columbia University,"S Chang, L Gravano, G Kaiser, K Ross, S Stolfo",SIGMOD Record,1998,581conf/sigmod/FlorescuGKR02,XL: a platform for web services,"D Florescu, A Grünhagen, D Kossmann, S Rost",SIGMOD Conference,2002,582conf/sigmod/CrescenziMM02,RoadRunner: automatic data extraction from data-intensive web sites,"V Crescenzi, G Mecca, P Merialdo",SIGMOD Conference,2002,583journals/sigmod/FlorescuLM98,Database Techniques for the World-Wide Web: A Survey,"D Florescu, A Levy, A Mendelzon",SIGMOD Record,1998,584journals/sigmod/KeetonPH98,A Case for Intelligent Disks (IDISKs),"K Keeton, D Patterson, J Hellerstein",SIGMOD Record,1998,585conf/sigmod/Bussler02,Software as a service: ASP and ASP aggregation,N/A,N/A,2002,586conf/sigmod/Mohan02,Tutorial: application servers and associated technologies,N/A,N/A,2002,587journals/sigmod/Lomet98,B-tree Page Size When Caching is Considered,D Lomet,SIGMOD Record,1998,588journals/sigmod/GriffinK98,Algebraic Change Propagation for Semijoin and Outerjoin Queries,"T Griffin, B Kumar",SIGMOD Record,1998,589conf/sigmod/GarofalakisGR02,Querying and mining data streams: you only get one look a tutorial,N/A,N/A,2002,590journals/sigmod/CheungF98,Enhanced Nearest Neighbour Search on the R-tree,"K Cheung, A Fu",SIGMOD Record,1998,591conf/sigmod/Cotton02,Implementing XQuery,P Cotton,SIGMOD Conference,2002,592conf/sigmod/BreunigKKS01,Data Bubbles: Quality Preserving Performance Boosting for Hierarchical Clustering,"M Breunig, H Kriegel, P Kröger, J Sander",SIGMOD Conference,2001,593journals/sigmod/TsotrasJS98,An Extensible Notation for Spatiotemporal Index Queries,"V Tsotras, C Jensen, R Snodgrass",SIGMOD Record,1998,594journals/sigmod/BurtonM98,Applications of the JAVA Programming Language to Database Management,"B Burton, V Marek",SIGMOD Record,1998,595conf/sigmod/RinfretOO01,Bit-Sliced Index Arithmetic,"D Rinfret, P O'Neil, E O'Neil",SIGMOD Conference,2001,596conf/sigmod/ChaudhuriDN01,"A Robust, Optimization-Based Approach for Approximate Answering of Aggregate Queries","S Chaudhuri, G Das, V Narasayya",SIGMOD Conference,2001,597journals/sigmod/Franklin98,Editor's Notes,M Franklin,SIGMOD Record,1998,598conf/sigmod/SlivinskasJS01,Adaptable Query Optimization and Evaluation in Temporal Middleware,"G Slivinskas, C Jensen, R Snodgrass",SIGMOD Conference,2001,599journals/sigmod/LometBCLN98,The Microsoft Database Research Group,"D Lomet, R Barga, S Chaudhuri, P Larson, V Narasayya",SIGMOD Record,1998,600journals/sigmod/EisenbergM98,Standards in Practice,"A Eisenberg, J Melton",SIGMOD Record,1998,601conf/sigmod/BohmBKK01,Epsilon Grid Order: An Algorithm for the Similarity Join on Massive High-Dimensional Data,"C Böhm, B Braunmüller, F Krebs, H Kriegel",SIGMOD Conference,2001,602conf/sigmod/ChenZCKR01,DyDa: Data Warehouse Maintenance in Fully Concurrent Environments,"J Chen, X Zhang, S Chen, A Koeller, E Rundensteiner",SIGMOD Conference,2001,603