idDBLP,title,authors,venue,year,Row_IDconf/sigmod/MoonSL00,Adaptive Multi-Stage Distance Join Processing,"H Shin, B Moon, S Lee",SIGMOD Conference,2000,800conf/sigmod/LiuPBHPT00,AQR-Toolkit: An Adaptive Query Routing Middleware for Distributed Data Intensive Systems,"L Liu, C Pu, D Buttler, W Han, H Paques, W Tang",SIGMOD Conference,2000,801journals/sigmod/KlasS94,Metadata for Digital Media: Introduction to the Special Issue,"W Klas, A Sheth",SIGMOD Record,1994,802journals/sigmod/Wedekind94,"\Are the Terms \""\""Version\""\"" and \""\""Variant\""\"" Orthogonal to One Another? A Critical Assessment of the STEP Standardization\""""",H Wedekind,SIGMOD Record,1994,803conf/sigmod/GillmannWSWW00,A Goal-driven Auto-Configuration Tool for the Distributed Workflow Management System Mentor-lite,"M Gillmann, J Weißenfels, G Shegalov, W Wonner, G Weikum",SIGMOD Conference,2000,804conf/sigmod/2000,"Proceedings of the 2000 ACM SIGMOD International Conference on Management of Data, May 16-18, 2000, Dallas, Texas, USA",N/A,N/A,2000,805journals/sigmod/JainH94,Metadata in Video Databases,"R Jain, A Hampapur",SIGMOD Record,1994,806journals/sigmod/BohmR94,Metadata for Multimedia Documents,"K Böhm, T Rakow",SIGMOD Record,1994,807conf/sigmod/OriaOILY00,DISIMA: A Distributed and Interoperable Image Database System,"V Oria, M Özsu, P Iglinski, S Lin, B Yao",SIGMOD Conference,2000,808conf/sigmod/RiedelFGN00,Data Mining on an OLTP System (Nearly) for Free,"E Riedel, C Faloutsos, G Ganger, D Nagle",SIGMOD Conference,2000,809journals/sigmod/ShinM94,A New Join Algorithm,"D Shin, A Meltzer",SIGMOD Record,1994,810conf/sigmod/HanPY00,Mining Frequent Patterns without Candidate Generation,"J Han, J Pei, Y Yin",SIGMOD Conference,2000,811journals/sigmod/Bertram94,Data Modelling in the Large,M Bertram,SIGMOD Record,1994,812journals/sigmod/Segev94b,Editor's Notes and Erratum,N/A,N/A,1994,813conf/sigmod/LakhamrajuRSS00,On-line Reorganization in Object Databases,"M Lakhamraju, R Rastogi, S Seshadri, S Sudarshan",SIGMOD Conference,2000,814conf/sigmod/ShenoyHSBBS00,Turbo-charging Vertical Mining of Large Databases,"P Shenoy, J Haritsa, S Sudarshan, G Bhalotia, M Bawa, D Shah",SIGMOD Conference,2000,815journals/sigmod/KiyokiKH94,A Metadatabase System for Semantic Image Search by a Mathematical Model of Meaning,"Y Kiyoki, T Kitagawa, T Hayama",SIGMOD Record,1994,816journals/sigmod/Alonso95,Trade Press News,N/A,N/A,1995,817conf/sigmod/HsiaoN00,DLFM: A Transactional Resource Manager,"H Hsiao, I Narang",SIGMOD Conference,2000,818journals/sigmod/SchlageterBHMSW95,The Database Group at University of Hagen (FernUniversitaet),"G Schlageter, T Berkel, E Heuel, S Mittrach, A Scherer, W Wilkes",SIGMOD Record,1995,819conf/sigmod/Ross00,Expressing Business Rules,R Ross,SIGMOD Conference,2000,820conf/sigmod/Jhingran00,Anatomy of a Real E-Commerce System,A Jhingran,SIGMOD Conference,2000,821journals/sigmod/X95,Calls for Papers and Announcements,N/A,SIGMOD Record,1995,822conf/sigmod/Weininger00,Handling Very Large Databases with Informix Extended Parallel Server,A Weininger,SIGMOD Conference,2000,823journals/sigmod/Qian95,Political Winds Change Direction Again,X Qian,SIGMOD Record,1995,824conf/sigmod/ChenDLT00,Fact: A Learning Based Web Query Processing System,"S Chen, Y Diao, H Lu, Z Tian",SIGMOD Conference,2000,825journals/sigmod/Jannink95,Implementing Deletion in B+-Trees,J Jannink,SIGMOD Record,1995,826journals/sigmod/NgH95,Multigranularity Locking in Multiple Job Classes Transaction Processing System,"S Ng, S Hung",SIGMOD Record,1995,827conf/sigmod/WangSSZZW00,An Approximate Search Engine for Structural Databases,"J Wang, X Wang, D Shasha, B Shapiro, K Zhang, X Zheng, Q Ma, Z Weinberg",SIGMOD Conference,2000,828conf/sigmod/JarkeQCLFLVV00,Concept Based Design of Data Warehouses: The DWQ Demonstrators,"M Jarke, C Quix, D Calvanese, M Lenzerini, E Franconi, S Ligoudistianos, P Vassiliadis, Y Vassiliou",SIGMOD Conference,2000,829journals/sigmod/Jarke95,Information Systems Research at RWTH Aachen,M Jarke,SIGMOD Record,1995,830conf/sigmod/Galhardas00,AJAX: An Extensible Data Cleaning Tool,"H Galhardas, D Florescu, D Shasha, E Simon",SIGMOD Conference,2000,831journals/sigmod/DarwenD95,The Third Manifesto,"H Darwen, C Date",SIGMOD Record,1995,832conf/sigmod/LitwinS00,LH*RS: A High-Availability Scalable Distributed Data Structure using Reed Solomon Codes,"W Litwin, T Schwarz",SIGMOD Conference,2000,833journals/sigmod/SellisV95,The Database Group at National Technical University of Athens (NTUA),"T Sellis, Y Vassiliou",SIGMOD Record,1995,834journals/sigmod/Qian95b,"Opportunities at ARPA, NSF, and Elsewhere",X Qian,SIGMOD Record,1995,835conf/sigmod/GoldmanW00,WSQ/DSQ: A Practical Approach for Combined Querying of Databases and the Web,"R Goldman, J Widom",SIGMOD Conference,2000,836journals/sigmod/EnglertGH95,Parallelism and its Price: A Case Study of NonStop SQL/MP,"S Englert, R Glasstone, W Hasan",SIGMOD Record,1995,837conf/sigmod/RodriguezR00,MOCHA: A Self-Extensible Database Middleware System for Distributed Data Sources,"M Rodriguez-Martinez, N Roussopoulos",SIGMOD Conference,2000,838journals/sigmod/VenkatraoP95,SQL/CLI - A New Binding Style for SQL,"M Venkatrao, M Pizzo",SIGMOD Record,1995,839conf/sigmod/LeeKOTM00,Towards Self-Tuning Data Placement in Parallel Database Systems,"M Lee, M Kitsuregawa, B Ooi, K Tan, A Mondal",SIGMOD Conference,2000,840journals/sigmod/SegevJS95,Report on The 1995 International Workshop on Temporal Databases,N/A,N/A,1995,841conf/sigmod/LabrinidisR00,WebView Materialization,"A Labrinidis, N Roussopoulos",SIGMOD Conference,2000,842journals/sigmod/Bohlen95,Temporal Database System Implementations,M Böhlen,SIGMOD Record,1995,843conf/sigmod/ChenJDTW00,NiagaraCQ: A Scalable Continuous Query System for Internet Databases,"J Chen, D DeWitt, F Tian, Y Wang",SIGMOD Conference,2000,844journals/sigmod/WolfsonSDNR95,View Maintenance in Mobile Computing,"O Wolfson, A Sistla, S Dao, K Narayanan, R Raj",SIGMOD Record,1995,845conf/sigmod/BarclaySG00,TerraServer: A Spatial Data Warehouse,"T Barclay, D Slutz, J Gray",SIGMOD Conference,2000,846conf/sigmod/SaltenisJLL00,Indexing the Positions of Continuously Moving Objects,"S Saltenis, C Jensen, S Leutenegger, M Lopez",SIGMOD Conference,2000,847journals/sigmod/AlonsoCIM95,Managing Video Data in a Mobile Environment,"R Alonso, Y Chang, L Iftode, V Mani",SIGMOD Record,1995,848conf/sigmod/SalemBCL00,How To Roll a Join: Asynchronous Incremental View Maintenance,"K Salem, K Beyer, R Cochrane, B Lindsay",SIGMOD Conference,2000,849journals/sigmod/DunhamH95a,Mobile Computing and Databases: Anything New?,"M Dunham, A Helal",SIGMOD Record,1995,850journals/sigmod/ElmagarmidJF95,Wireless Client/Server Computing for Personal Information Services and Applications,"A Elmagarmid, J Jing, T Furukawa",SIGMOD Record,1995,851conf/sigmod/ChristophidesCS00,On Wrapping Query Languages and Efficient XML Integration,"V Christophides, S Cluet, J Siméon",SIGMOD Conference,2000,852journals/sigmod/DrewHKKLLLSW95,Data and Knowledge Base Research at Hong Kong University of Science and Technology,"P Drew, B Hamidzadeh, K Karlapalem, A Kean, D Lee, Q Li, F Lochovsky, C Shum, B Wüthrich",SIGMOD Record,1995,853conf/sigmod/BreunigKNS00,LOF: Identifying Density-Based Local Outliers,"M Breunig, H Kriegel, R Ng, J Sander",SIGMOD Conference,2000,854conf/sigmod/ChoG00,Synchronizing a Database to Improve Freshness,"J Cho, H Garcia-Molina",SIGMOD Conference,2000,855journals/sigmod/DunhamH95,From the Guest Editors - Special Section on Data Management Issues in Mobile Computing,"M Dunham, A Helal",N/A,1995,856journals/sigmod/BhargavaAP95,Digital Library Services in Mobile Computing,"B Bhargava, M Annamalai, E Pitoura",SIGMOD Record,1995,857conf/sigmod/FaloutsosSTT00,Spatial Join Selectivity Using Power Laws,"C Faloutsos, B Seeger, A Traina, C Jr.",SIGMOD Conference,2000,858conf/sigmod/KornM00,Influence Sets Based on Reverse Nearest Neighbor Queries,"F Korn, S Muthukrishnan",SIGMOD Conference,2000,859journals/sigmod/Ulusoy95,An Annotated Bibliography on Real-Time Database Systems,Ö Ulusoy,SIGMOD Record,1995,860conf/sigmod/LiefkeS00,XMILL: An Efficient Compressor for XML Data,"H Liefke, D Suciu",SIGMOD Conference,2000,861journals/sigmod/Widom95a,Editor's Notes,J Widom,SIGMOD Record,1995,862journals/sigmod/NobleS95,A Research Status Report on Adaptation for Mobile Data Access,"B Noble, M Satyanarayanan",SIGMOD Record,1995,863conf/sigmod/GarofalakisGRSS00,XTRACT: A System for Extracting Document Type Descriptors from XML Documents,"M Garofalakis, A Gionis, R Rastogi, S Seshadri, K Shim",SIGMOD Conference,2000,864journals/sigmod/Fong95,Mapping Extended Entity Relationship Model to Object Modeling Technique,J Fong,SIGMOD Record,1995,865conf/sigmod/Nori00,Application Architecture: 2Tier or 3Tier? What is DBMS's Role? (Panel Abstract),A Nori,SIGMOD Conference,2000,866conf/sigmod/Hellerstein00,Index Research: Forest or Trees? (Panel Abstract),J Hellerstein,SIGMOD Conference,2000,867journals/sigmod/ONeilG95,Multi-Table Joins Through Bitmapped Join Indices,"P O'Neil, G Graefe",SIGMOD Record,1995,868journals/sigmod/MaelbranckeO95,Optimizing Jan Jannink's Implementation of B+-tree Deletion,"R Maelbrancke, H Olivie",SIGMOD Record,1995,869conf/sigmod/Ramakrishnan00,From Browsing to Interacting: DBMS Support for Responive Websites (Abstract),R Ramakrishnan,SIGMOD Conference,2000,870journals/sigmod/AbiteboulH95,"\Response to \""\""A Close Look at the IFO Data Model\""\""\""""","S Abiteboul, R Hull",SIGMOD Record,1995,871conf/sigmod/OrdonezC00,SQLEM: Fast Clustering in SQL using the EM Algorithm,"C Ordonez, P Cereghini",SIGMOD Conference,2000,872conf/sigmod/BlakeleyD00,Tutorial: Data Access,N/A,N/A,2000,873journals/sigmod/Richey95,Condition Handling in SQL Persistent Stored Modules,J Richey,SIGMOD Record,1995,874journals/sigmod/RosenthalSMBTL95,Data Management Research at The MITRE Corporation,"A Rosenthal, L Seligman, C McCollum, B Blaustein, B Thuraisingham, E Lafferty",SIGMOD Record,1995,875conf/sigmod/Gal00,"Data Management in eCommerce: The Good, the Bad, and the Ugly",N/A,N/A,2000,876conf/sigmod/BratsbergT00,Tutorial: Designing an Ultra Highly Available DBMS,N/A,N/A,2000,877journals/sigmod/RisheSBDOALOSS95,Florida International University High Performance Database Research Center,"N Rishe, W Sun, D Barton, Y Deng, C Orji, M Alexopoulos, L Loureiro, C 0002, M Sanchez, A Shaposhnikov",SIGMOD Record,1995,878journals/sigmod/PitouraB95,A Framework for Providing Consistent and Recoverable Agent-Based Access to Heterogeneous in Mobile Databases,"E Pitoura, B Bhargava",SIGMOD Record,1995,879conf/sigmod/Carey00,On XML and Databases: Where's the Beef? (Panel Abstract),M Carey,SIGMOD Conference,2000,880conf/sigmod/RaoR00,Making B+-Trees Cache Conscious in Main Memory,"J Rao, K Ross",SIGMOD Conference,2000,881journals/sigmod/Wong95,An Introduction to Remy's Fast Polymorphic Record Projection,L Wong,SIGMOD Record,1995,882journals/sigmod/LeeCL95,An Aspect of Query Optimization in Multidatabase Systems (Extended Abstract),"C Lee, C Chen, H Lu",SIGMOD Record,1995,883conf/sigmod/AgrawalS00,Privacy-Preserving Data Mining,"R Agrawal, R Srikant",SIGMOD Conference,2000,884journals/sigmod/DoanPK95,Design and User Testing of a Multi-Paradigm Query Interface to an Object-Oriented Database,"D Doan, N Paton, A Kilgour",SIGMOD Record,1995,885conf/sigmod/JagadishKS00,On Effective Multi-Dimensional Indexing for Strings,"H Jagadish, N Koudas, D Srivastava",SIGMOD Conference,2000,886journals/sigmod/Widom95,Editor's Notes,J Widom,SIGMOD Record,1995,887conf/sigmod/ChangBCLLS00,The Onion Technique: Indexing for Linear Optimization Queries,"Y Chang, L Bergman, V Castelli, C Li, M Lo, J Smith",SIGMOD Conference,2000,888conf/sigmod/ChenCPPSTM00,Internet Traffic Warehouse,"C Chen, M Cochinwala, C Petrone, M Pucci, S Samtani, P Santa, M Mesiti",SIGMOD Conference,2000,889journals/sigmod/X95a,Calls for Papers and Announcements,N/A,SIGMOD Record,1995,890conf/sigmod/AnnamalaiCD00,Indexing Images in Oracle8i,"M Annamalai, R Chopra, S DeFazio",SIGMOD Conference,2000,891journals/sigmod/Finkelstein95,The New Middleware,R Finkelstein,SIGMOD Record,1995,892journals/sigmod/Stacey95,"Replication: DB2, Oracle, or Sybase?",D Stacey,SIGMOD Record,1995,893conf/sigmod/PonnekantiK00,Online Index Rebuild,"N Ponnekanti, H Kodavalla",SIGMOD Conference,2000,894journals/sigmod/Alonso95a,Trade Press News,N/A,N/A,1995,895conf/sigmod/LehnerSPC00,Maintenance of Automatic Summary Tables,"W Lehner, R Sidle, H Pirahesh, R Cochrane",SIGMOD Conference,2000,896journals/sigmod/Alonso94,Trade Press News,N/A,N/A,1994,897conf/sigmod/BressanGOT00,Integrating Replacement Policies in StorM: An Extensible Approach,"C Goh, B Ooi, S Bressan, K Tan",SIGMOD Conference,2000,898journals/sigmod/Winslett94,Progress on HPCC and NII,M Winslett,SIGMOD Record,1994,899conf/sigmod/ReveszCKLLW00,The MLPQ/GIS Constraint Database System,"P Revesz, R Chen, P Kanjamala, Y Li, Y Liu, Y Wang",SIGMOD Conference,2000,900conf/sigmod/ChakrabartiM99,Efficient Concurrency Control in Multidimensional Access Methods,"K Chakrabarti, S Mehrotra",SIGMOD Conference,1999,901journals/tods/TaoSP03,Analysis of predictive spatio-temporal queries,"Y Tao, J Sun, D Papadias",ACM Trans. Database Syst.,2003,902journals/tods/LakshmananLN03,Efficient dynamic mining of constrained frequent sets,"L Lakshmanan, C Leung, R Ng",ACM Trans. Database Syst.,2003,903conf/sigmod/AggarwalPWYP99,Fast Algorithms for Projected Clustering,"C Aggarwal, C Procopiuc, J Wolf, P Yu, J Park",SIGMOD Conference,1999,904conf/sigmod/HsuLG00,Image Mining in IRIS: Integrated Retinal Information System,"W Hsu, M Lee, K Goh",SIGMOD Conference,2000,905journals/tods/ChoG03,Effective page refresh policies for Web crawlers,"J Cho, H Garcia-Molina",ACM Trans. Database Syst.,2003,906journals/tods/Chomicki03,Preference formulas in relational queries,J Chomicki,ACM Trans. Database Syst.,2003,907conf/sigmod/Rodriguez-Martinez00,MOCHA: A Database Middleware System Featuring Automatic Deployment of Application-Specific Functionality,"M Rodriguez-Martinez, N Roussopoulos, J McGann, S Kelley, V Katz, Z Song, J JáJá",SIGMOD Conference,2000,908conf/sigmod/YangYW00,TIP: A Temporal Extension to Informix,"J Yang, H Ying, J Widom",SIGMOD Conference,2000,909journals/tods/DiaoAFZF03,Path sharing and predicate evaluation for high-performance XML filtering,"Y Diao, M Altinel, M Franklin, H Zhang, P Fischer",ACM Trans. Database Syst.,2003,910conf/sigmod/LiBCS00,SPIRE: A Progressive Content-Based Spatial Image Retrieval Engine,"C Li, L Bergman, V Castelli, J Smith",SIGMOD Conference,2000,911journals/tods/HjaltasonS03,Index-driven similarity search in metric spaces,"G Hjaltason, H Samet",ACM Trans. Database Syst.,2003,912conf/sigmod/MerialdoAMMP00,Homer: a Model-Based CASE Tool for Data-Intensive Web Sites,"P Merialdo, P Atzeni, M Magnante, G Mecca, M Pecorone",SIGMOD Conference,2000,913journals/sigmod/DreyerDS94,Research Perspectives for Time Series Management Systems,"W Dreyer, A Dittrich, D Schmidt",SIGMOD Record,1994,914journals/sigmod/DiazJPa94,Supporting Dynamic Displays Using Active Rules,"O Díaz, A Jaime, N Paton, G al-Qaimari",SIGMOD Record,1994,915conf/sigmod/BerckenDS00,javax.XXL: A prototype for a Library of Query processing Algorithms,"J Bercken, J Dittrich, B Seeger",SIGMOD Conference,2000,916journals/sigmod/Snodgrass94,Overview of the Special Section on Temporal Database Infrastructure,R Snodgrass,SIGMOD Record,1994,917conf/sigmod/Sarawagi00,"i3: Intelligent, Interactive Investigaton of OLAP data cubes","S Sarawagi, G Sathe",SIGMOD Conference,2000,918conf/sigmod/PeiMHZ00,Towards Data Mining Benchmarking: A Testbed for Performance Study of Frequent Pattern Mining,"J Pei, R Mao, K Hu, H Zhu",SIGMOD Conference,2000,919journals/sigmod/PissinouSEMOPSTD94,Towards an Infrastructure for Temporal Databases: Report of an Invitational ARPA/NSF Workshop,N/A,N/A,1994,920conf/sigmod/ShuklaD00,Tutorial: LDAP Directory Services - Just Another Database Application?,N/A,N/A,2000,921journals/sigmod/SnodgrassAABCDEGJKKKLLRSSS94,TSQL2 Language Specification,"R Snodgrass, I Ahn, G Ariav, D Batory, J Clifford, C Dyreson, R Elmasri, F Grandi, C Jensen, W Käfer, N Kline, K Kulkarni, T Leung, N Lorentzos, J Roddick, A Segev, M Soo, S Sripada",SIGMOD Record,1994,922journals/sigmod/Loeffen94,Text Databases: A Survey of Text Models and Systems,A Loeffen,SIGMOD Record,1994,923conf/sigmod/IvesLPST00,Self-Organizing Data Sharing Communities with SAGRES,"Z Ives, A Levy, J Madhavan, R Pottinger, S Saroiu, I Tatarinov, S Betzler, Q Chen, E Jaslikowska, J Su, W Yeung",SIGMOD Conference,2000,924journals/sigmod/NorrieBSW94,The Database Research Group at ETH Zurich,"M Norrie, S Blott, H Schek, G Weikum",SIGMOD Record,1994,925conf/sigmod/FegarasSRM00,lambda-DB: An ODMG-Based Object-Oriented DBMS,"L Fegaras, C Srinivasan, A Rajendran, D Maier",SIGMOD Conference,2000,926journals/sigmod/Gallagher94,Influencing Database Language Standards,L Gallagher,SIGMOD Record,1994,927conf/sigmod/RundensteinerCCSO00,SERFing the Web: Web Site Management Made Easy,"E Rundensteiner, K Claypool, L Chen, H Su, K Oenoki",SIGMOD Conference,2000,928conf/sigmod/YerneniLGU99,Computing Capabilities of Mediators,"R Yerneni, C Li, H Garcia-Molina, J Ullman",SIGMOD Conference,1999,929journals/tods/MayL02,Understanding the global semantics of referential actions using logic rules,"W May, B Ludäscher",ACM Trans. Database Syst.,2002,930conf/sigmod/Keim99,Efficient Geometry-based Similarity Search of 3D Spatial Databases,D Keim,SIGMOD Conference,1999,931journals/tods/MelnikG03,Adaptive algorithms for set containment joins,"S Melnik, H Garcia-Molina",ACM Trans. Database Syst.,2003,932conf/sigmod/DavulcuFKR99,A Layered Architecture for Querying Dynamic Web Content,"H Davulcu, J Freire, M Kifer, I Ramakrishnan",SIGMOD Conference,1999,933journals/tods/FernandezKSMT02,SilkRoute: A framework for publishing relational data in XML,"M Fernandez, Y Kadiyska, D Suciu, A Morishima, W Tan",ACM Trans. Database Syst.,2002,934journals/tods/CiacciaP02,Searching in metric spaces with user-defined and approximate distances,"P Ciaccia, M Patella",ACM Trans. Database Syst.,2002,935conf/sigmod/CallanCD99,Automatic Discovery of Language Models for Text Databases,"J Callan, M Connell, A Du",SIGMOD Conference,1999,936conf/sigmod/BeyerR99,Bottom-Up Computation of Sparse and Iceberg CUBEs,"K Beyer, R Ramakrishnan",SIGMOD Conference,1999,937journals/tods/GibbonsMP02,Fast incremental maintenance of approximate histograms,"P Gibbons, Y Matias, V Poosala",ACM Trans. Database Syst.,2002,938conf/sigmod/MayrS99,Client-Site Query Extensions,"T Mayr, P Seshadri",SIGMOD Conference,1999,939journals/tods/CaldersNW02,Searching for dependencies at multiple abstraction levels,"T Calders, R Ng, J Wijsen",ACM Trans. Database Syst.,2002,940conf/sigmod/AggarwalWY99,A New Method for Similarity Indexing of Market Basket Data,"C Aggarwal, J Wolf, P Yu",SIGMOD Conference,1999,941journals/tods/ChakrabartiKMP02,Locally adaptive dimensionality reduction for indexing large time series databases,"K Chakrabarti, E Keogh, S Mehrotra, M Pazzani",ACM Trans. Database Syst.,2002,942journals/tods/TaoPZ02,Cost models for overlapping and multiversion structures,"Y Tao, D Papadias, J Zhang",ACM Trans. Database Syst.,2002,943conf/sigmod/KotidisR99,DynaMat: A Dynamic View Management System for Data Warehouses,"Y Kotidis, N Roussopoulos",SIGMOD Conference,1999,944conf/sigmod/ChanI99,An Efficient Bitmap Encoding Scheme for Selection Queries,"C Chan, Y Ioannidis",SIGMOD Conference,1999,945journals/tods/JacoxS03,Iterative spatial join,"E Jacox, H Samet",ACM Trans. Database Syst.,2003,946conf/sigmod/VitterW99,Approximate Computation of Multidimensional Aggregates of Sparse Data Using Wavelets,"J Vitter, M Wang",SIGMOD Conference,1999,947journals/tods/WijesekeraJPH03,Removing permissions in the flexible authorization framework,"D Wijesekera, S Jajodia, F Parisi-Presicce, Å Hagström",ACM Trans. Database Syst.,2003,948conf/sigmod/IvesFFLW99,An Adaptive Query Execution System for Data Integration,"Z Ives, D Florescu, M Friedman, A Levy, D Weld",SIGMOD Conference,1999,949journals/tods/TaoP03,Spatial queries in dynamic environments,"Y Tao, D Papadias",ACM Trans. Database Syst.,2003,950conf/sigmod/BlohsfeldKS99,A Comparison of Selectivity Estimators for Range Queries on Metric Attributes,"B Blohsfeld, D Korus, B Seeger",SIGMOD Conference,1999,951journals/tods/Jimenez-PerisPAK03,Are quorums an alternative for data replication?,"R Jiménez-Peris, M Patiño-Martínez, G Alonso, B Kemme",ACM Trans. Database Syst.,2003,952conf/sigmod/Jamil99,Belief Reasoning in MLS Deductive Databases,H Jamil,SIGMOD Conference,1999,953journals/tods/LechtenborgerV03,On the computation of relational view complements,"J Lechtenbörger, G Vossen",ACM Trans. Database Syst.,2003,954journals/tods/GunopulosKMSTS03,Discovering all most specific sentences,"D Gunopulos, R Khardon, H Mannila, S Saluja, H Toivonen, R Sharm",ACM Trans. Database Syst.,2003,955conf/sigmod/ShanmugasundaramNSR99,Efficient Concurrency Control for Broadcast Environments,"J Shanmugasundaram, A Nithrakashyap, R Sivasankaran, K Ramamritham",SIGMOD Conference,1999,956journals/tods/KarpSP03,A simple algorithm for finding frequent elements in streams and bags,"R Karp, S Shenker, C Papadimitriou",ACM Trans. Database Syst.,2003,957conf/sigmod/GehrkeGRL99,BOAT-Optimistic Decision Tree Construction,"J Gehrke, V Ganti, R Ramakrishnan, W Loh",SIGMOD Conference,1999,958conf/sigmod/AdaliSS99,A Multimedia Presentation Algebra,"S Adali, M Sapino, V Subrahmanian",SIGMOD Conference,1999,959journals/tods/BeneventanoBS03,Description logics for semantic query optimization in object-oriented database systems,"D Beneventano, S Bergamaschi, C Sartori",ACM Trans. Database Syst.,2003,960journals/sigmod/Segev94a,Editor's Notes,A Segev,SIGMOD Record,1994,961conf/sigmod/CruzJ99,A User-Centered Interface for Querying Distributed Multimedia Databases,"I Cruz, K James",SIGMOD Conference,1999,962journals/sigmod/SnodgrassAABCDEGJKKKLLRSSS94a,A TSQL2 Tutorial,"nodgrass, I Ahn, G Ariav, D Batory, J Clifford, C Dyreson, R Elmasri, F Grandi, C Jensen, W Käfer, N Kline, K Kulkarni, T Leung, N Lorentzos, J Roddick, A Segev, M Soo, S Sripada",SIGMOD Record,1994,963conf/sigmod/MamoulisP99,Integration of Spatial Join Algorithms for Processing Multiple Inputs,"N Mamoulis, D Papadias",SIGMOD Conference,1999,964conf/sigmod/RundensteinerKZWLLN99,Evolvable View Environment (EVE): Non-Equivalent View Maintenance under Schema Changes,"E Rundensteiner, A Koeller, X Zhang, A Wyk, Y Li, A Lee, A Nica",SIGMOD Conference,1999,965journals/sigmod/Qian94a,"Announcements from NSF, NASA, and Elsewhere",X Qian,SIGMOD Record,1994,966journals/sigmod/X94b,Calls for Papers / Announcements,N/A,SIGMOD Record,1994,967conf/sigmod/NgLHM99,Exploratory Mining via Constrained Frequent Set Queries,"R Ng, L Lakshmanan, J Han, T Mah",SIGMOD Conference,1999,968journals/sigmod/Datta94,Research Issues in Databases for ARCS: Active Rapidly Changing Data Systems,A Datta,SIGMOD Record,1994,969conf/sigmod/WolfsonSXZC99,DOMINO: Databases fOr MovINg Objects tracking,"O Wolfson, A Sistla, B Xu, J Zhou, S Chamberlain",SIGMOD Conference,1999,970conf/sigmod/BraumandlKK99,Database Patchwork on the Internet,"R Braumandl, A Kemper, D Kossmann",SIGMOD Conference,1999,971journals/sigmod/Klein94,How to Modify SQL Queries in Order to Guarantee Sure Answers,H Klein,SIGMOD Record,1994,972journals/sigmod/Chen94,Database Research at NTHU and ITRI,A Chen,SIGMOD Record,1994,973conf/sigmod/LiuHBPT99,An XML-based Wrapper Generator for Web Information Extraction,"L Liu, W Han, D Buttler, C Pu, W Tang",SIGMOD Conference,1999,974journals/sigmod/Group94,"Response to the March 1994 ODMG-93 Commentary Written by Dr. Won Kim of UniSQL, Inc",O Group,SIGMOD Record,1994,975conf/sigmod/AltinelABFSZ99,DBIS-Toolkit: Adaptable Middleware for Large Scale Data Delivery,"M Altinel, D Aksoy, T Baby, M Franklin, W Shapiro, S Zdonik",SIGMOD Conference,1999,976conf/sigmod/Greer99,Daytona And The Fourth-Generation Language Cymbal,R Greer,SIGMOD Conference,1999,977journals/sigmod/GlavitschSW94,Metadata for Integrating Speech Documents in a Text Retrieval System,"U Glavitsch, P Schäuble, M Wechsler",SIGMOD Record,1994,978journals/sigmod/ChenHKPW94,Metadata for Mixed-Media Access,"F Chen, M Hearst, J Kupiec, J Pedersen, L Wilcox",SIGMOD Record,1994,979conf/sigmod/TrisoliniLN99,Data Integration and Warehousing in Telecom Italia,"S Trisolini, M Lenzerini, D Nardi",SIGMOD Conference,1999,980journals/sigmod/AndersonS94,SEQUOIA 2000 Metadata Schema for Satellite Images,"J Anderson, M Stonebraker",SIGMOD Record,1994,981conf/sigmod/BaulierBGGHJKKMMNNRSSSWW99,DataBlitz Storage Manager: Main Memory Database Performance for Critical Applications,"J Baulier, P Bohannon, S Gogate, C Gupta, S Haldar, S Joshi, A Khivesera, H Korth, P McIlroy, J Miller, P Narayan, M Nemeth, R Rastogi, S Seshadri, A Silberschatz, S Sudarshan, M Wilder, C Wei",SIGMOD Conference,1999,982journals/sigmod/GroskyFS94,Using Metadata for the Intelligent Browsing of Structured Media Objects,"W Grosky, F Fotouhi, I Sethi",SIGMOD Record,1994,983conf/sigmod/Kohler99,EMC Information Sharing: Direct Access to MVS Data from Unix and NT,W Kohler,SIGMOD Conference,1999,984journals/sigmod/Alonso94b,Trade Press News - Announcement and Preface,N/A,N/A,1994,985conf/sigmod/HinneburgK99,Clustering Methods for Large Databases: From the Past to the Future,"A Hinneburg, D Keim",SIGMOD Conference,1999,986conf/sigmod/KrishnamurthyBN99,Bringing Object-Relational Technology to Mainstream,"V Krishnamurthy, S Banerjee, A Nori",SIGMOD Conference,1999,987