idDBLP,title,authors,venue,year,Row_IDjournals/sigmod/VelACM01,Mining Email Content for Author Identification Forensics,"O Vel, A Anderson, M Corney, G Mohay",SIGMOD Record,2001,214journals/sigmod/Scholl01,Transactional Information Systems - Book Review,N/A,N/A,2001,215conf/sigmod/IlyasRLGL03,Estimating Compilation Time of a Query Optimizer,"I Ilyas, J Rao, G Lohman, D Gao, E Lin",SIGMOD Conference,2003,216conf/sigmod/DeligiannakisR03,Extended Wavelets for Multiple Measures,"A Deligiannakis, N Roussopoulos",SIGMOD Conference,2003,217journals/sigmod/Jagadish01,Information Warfare and Security - Book Review,N/A,N/A,2001,218journals/sigmod/Winslett01a,"Gio Wiederhold Speaks Out on Moving into Academia in Mid-Career, How to Be an Effective Consultant, Why You Should Be a Program Manager as a Funding Agency, the Need for Ontology Algebra and Simulations, and More",N/A,N/A,2001,219conf/sigmod/BabcockBDM03,Chain : Operator Scheduling for Memory Minimization in Data Stream Systems,"B Babcock, S Babu, M Datar, R Motwani",SIGMOD Conference,2003,220journals/sigmod/LohmanGFS01,SIGMOD 2001 Industry Sessions,"G Lohman, C Galindo-Legaria, M Franklin, L Seligman",SIGMOD Record,2001,221conf/sigmod/BenediktCFFR03,Capturing both Types and Constraints in Data Integration,"M Benedikt, C Chan, W Fan, J Freire, R Rastogi",SIGMOD Conference,2003,222journals/sigmod/RossHLW01,Reminiscences on Influential Papers,N/A,N/A,2001,223conf/sigmod/MiloAABN03,Exchanging Intensional XML Data,"T Milo, S Abiteboul, B Amann, O Benjelloun, F Ngoc",SIGMOD Conference,2003,224conf/vldb/TsatalosSI94,The GMAP: A Versatile Tool for Physical Data Independence,"O Tsatalos, M Solomon, Y Ioannidis",VLDB,1994,225journals/sigmod/TianDCZ02,The Design and Performance Evaluation of Alternative XML Storage Strategies,"F Tian, D DeWitt, J Chen, C Zhang",SIGMOD Record,2002,226journals/sigmod/Dogac02,Guest Editor's Introduction,N/A,N/A,2002,227conf/vldb/ChaudhuriS94,Including Group-By in Query Optimization,"S Chaudhuri, K Shim",VLDB,1994,228conf/vldb/MatthesS94,Persistent Threads,"F Matthes, J Schmidt",VLDB,1994,229journals/sigmod/SommerGB02,The n-Tier Hub Technology,"R Sommer, T Gulledge, D Bailey",SIGMOD Record,2002,230journals/sigmod/Cingil02,Supporting Global User Profiles Through Trusted Authorities,I Cingil,SIGMOD Record,2002,231conf/vldb/DavisonG94,Memory-Contention Responsive Hash Joins,"D Davison, G Graefe",VLDB,1994,232journals/sigmod/QuixSJ02,Business Data Management for B2B Electronic Commerce,"C Quix, M Schoop, M Jeusfeld",SIGMOD Record,2002,233conf/vldb/MedianoCD94,V-Trees - A Storage Method for Long Vector Data,"M Mediano, M Casanova, M Dreux",VLDB,1994,234conf/vldb/GaasterlandL94,Qualified Answers That Reflect User Needs and Preferences,"T Gaasterland, J Lobo",VLDB,1994,235journals/sigmod/CuiJO02,Semantic B2B Integration: Issues in Ontology-based Applications,"Z Cui, D Jones, P O'Brien",SIGMOD Record,2002,236conf/vldb/LitwinNS94,RP*: A Family of Order Preserving Scalable Distributed Data Structures,"W Litwin, M Neimat, D Schneider",VLDB,1994,237journals/sigmod/Bussler02,The Role of B2B Engines in B2B Integration Architectures,C Bussler,SIGMOD Record,2002,238journals/sigmod/BallMRZ02,Supply Chain Infrastructures: System Integration and Information Sharing,"M Ball, M Ma, L Raschid, Z Zhao",SIGMOD Record,2002,239conf/vldb/ChawatheCY94,On Index Selection Schemes for Nested Object Hierarchies,"S Chawathe, M Chen, P Yu",VLDB,1994,240journals/sigmod/Winslett02,Interview with Avi Silberschatz,N/A,N/A,2002,241conf/vldb/SistlaYH94,Reasoning About Spatial Relationships in Picture Retrieval Systems,"A Sistla, C Yu, R Haddad",VLDB,1994,242journals/sigmod/Grefen02,What Will Be - Book Review,N/A,N/A,2002,243conf/vldb/LuOT94,On Spatially Partitioned Temporal Join,"H Lu, B Ooi, K Tan",VLDB,1994,244conf/vldb/HjelsvoldM94,Modelling and Querying Video Data,"R Hjelsvold, R Midtstraum",VLDB,1994,245journals/sigmod/Stonebraker02,Too Much Middleware,M Stonebraker,SIGMOD Record,2002,246conf/vldb/PirotteZMY94,Materialization: A Powerful and Ubiquitous Abstraction Pattern,"A Pirotte, E Zimányi, D Massart, T Yakusheva",VLDB,1994,247journals/sigmod/Suciu02,The XML Typechecking Problem,D Suciu,SIGMOD Record,2002,248journals/sigmod/GobleR02,Report on the 18th British National Conference on Databases (BNCOD),N/A,N/A,2002,249conf/vldb/NgY94,Maximizing Buffer and Disk Utilizations for News On-Demand,"R Ng, J Yang",VLDB,1994,250journals/sigmod/RossKMV02,Reminiscences on Influential Papers,N/A,N/A,2002,251conf/vldb/PoulovassilisS94,Investigation of Algebraic Query Optimisation Techniques for Database Programming Languages,"A Poulovassilis, C Small",VLDB,1994,252conf/vldb/XieH94,Join Index Hierarchies for Supporting Efficient Navigations in Object-Oriented Databases,"Z Xie, J Han",VLDB,1994,253journals/sigmod/Elderini02,Letter to SIGMOD Record Editor,N Elderini,N/A,2002,254conf/vldb/KamelF94,Hilbert R-tree: An Improved R-tree using Fractals,"I Kamel, C Faloutsos",VLDB,1994,255journals/sigmod/Snodgrass02,Why I Like Working in Academia,R Snodgrass,SIGMOD Record,2002,256journals/sigmod/VassiliadisS99,A Survey of Logical Models for OLAP Databases,"P Vassiliadis, T Sellis",SIGMOD Record,1999,257conf/sigmod/LakshmananPZ03,QC-Trees: An Efficient Summary Structure for Semantic OLAP,"L Lakshmanan, J Pei, Y Zhao",SIGMOD Conference,2003,258journals/sigmod/JacobS99,FinTime - A Financial Time Series Benchmark,"K Jacob, D Shasha",SIGMOD Record,1999,259conf/sigmod/WitkowskiBBDFGSS03,Spreadsheets in RDBMS for OLAP,"A Witkowski, S Bellamkonda, T Bozkaya, G Dorman, N Folkert, A Gupta, L Sheng, S Subramanian",SIGMOD Conference,2003,260conf/sigmod/GuoSBS03,XRANK: Ranked Keyword Search over XML Documents,"L Guo, F Shao, C Botev, J Shanmugasundaram",SIGMOD Conference,2003,261journals/sigmod/KempsterST99,Diluting ACID,"T Kempster, C Stirling, P Thanisch",SIGMOD Record,1999,262conf/sigmod/Al-KhalifaYJ03,Querying Structured Text in an XML Database,"S Al-Khalifa, C Yu, H Jagadish",SIGMOD Conference,2003,263journals/sigmod/GatziuJSV99,Design and Management of Data Warehouses: Report on the DMDW'99 Workshop,"S Gatziu, M Jeusfeld, M Staudt, Y Vassiliou",SIGMOD Record,1999,264conf/sigmod/WangPFY03,ViST: A Dynamic Index Method for Querying XML Data by Tree Structures,"H Wang, S Park, W Fan, P Yu",SIGMOD Conference,2003,265journals/sigmod/Franklin99b,Editor's Notes,M Franklin,SIGMOD Record,1999,266conf/sigmod/SionAP03,Rights Protection for Relational Data,"R Sion, M Atallah, S Prabhakar",SIGMOD Conference,2003,267journals/sigmod/EisenbergM00,SQL Standardization: The Next Steps,"A Eisenberg, J Melton",SIGMOD Record,2000,268journals/sigmod/RossFLOSSVW00,Reminiscences on Influential Papers,N/A,N/A,2000,269conf/sigmod/AgrawalES03,Information Sharing Across Private Databases,"R Agrawal, A Evfimievski, R Srikant",SIGMOD Conference,2003,270journals/sigmod/DongS00,Incremental Maintenance of Recursive Views Using Relational Calculus/SQL,"G Dong, J Su",SIGMOD Record,2000,271conf/sigmod/SchleimerWA03,Winnowing: Local Algorithms for Document Fingerprinting,"S Schleimer, D Wilkerson, A Aiken",SIGMOD Conference,2003,272conf/sigmod/JohnsonD03,Data Quality and Data Cleaning: An Overview,"T Johnson, T Dasu",SIGMOD Conference,2003,273journals/sigmod/Jagadish00,ACM-SIGMOD Digital Review,H Jagadish,SIGMOD Record,2000,274journals/sigmod/CeriKKLOSV00,SIGMOD Sister Societies,"S Ceri, L Kalinichenko, M Kitsuregawa, H Lu, Z Özsoyoglu, R Snodgrass, V Vianu",SIGMOD Record,2000,275conf/sigmod/GuptaLM03,BIRN-M: A Semantic Mediator for Solving Real-World Neuroscience Problems,"A Gupta, B Ludäscher, M Martone",SIGMOD Conference,2003,276conf/sigmod/AgrawalK03,A System for Watermarking Relational Databases,"R Agrawal, P Haas, J Kiernan",SIGMOD Conference,2003,277journals/sigmod/Snodgrass00,Chair's Message,N/A,N/A,2000,278journals/sigmod/PaepckeGRC00,Beyond Document Similarity: Understanding Value-Based Search and Browsing Technologies,"A Paepcke, H Garcia-Molina, G Rodríguez-Mulà, J Cho",SIGMOD Record,2000,279conf/sigmod/AbadiCCCCEGHMRSSTXYZ03,Aurora: A Data Stream Management System,"D Abadi, D Carney, U Çetintemel, M Cherniack, C Convey, C Erwin, E Galvez, M Hatoun, A Maskey, A Rasin, A Singer, M Stonebraker, N Tatbul, Y Xing, R Yan, S Zdonik",SIGMOD Conference,2003,280conf/sigmod/Ullman03,Improving the Efficiency of Database-System Teaching,J Ullman,SIGMOD Conference,2003,281journals/sigmod/BonifatiC00,Comparative Analysis of Five XML Query Languages,"A Bonifati, S Ceri",SIGMOD Record,2000,282journals/sigmod/LiefkeS00,An Extensible Compressor for XML Data,"H Liefke, D Suciu",SIGMOD Record,2000,283conf/sigmod/2003,"Proceedings of the 2003 ACM SIGMOD International Conference on Management of Data, San Diego, California, USA, June 9-12, 2003",N/A,N/A,2003,284journals/sigmod/Vassilakis00,An Optimisation Scheme for Coalesce/Valid Time Selection Operator Sequences,C Vassilakis,SIGMOD Record,2000,285conf/sigmod/Mamoulis03,Efficient Processing of Joins on Set-valued Attributes,N Mamoulis,SIGMOD Conference,2003,286journals/sigmod/PourabbasR00,Hierarchies and Relative Operators in the OLAP Environment,"E Pourabbas, M Rafanelli",SIGMOD Record,2000,287conf/sigmod/JagatheesanR03,Data Grid Management Systems,"A Jagatheesan, A Rajasekar",SIGMOD Conference,2003,288conf/sigmod/ChengKP03,Evaluating Probabilistic Queries over Imprecise Data,"R Cheng, D Kalashnikov, S Prabhakar",SIGMOD Conference,2003,289journals/sigmod/RoddickABDEGHLMMMW00,Evolution and Change in Data Management - Issues and Directions,"J Roddick, L Al-Jadir, L Bertossi, M Dumas, F Estrella, H Gregersen, K Hornsby, J Lufter, F Mandreoli, T Männistö, E Mayol, L Wedemeijer",SIGMOD Record,2000,290conf/sigmod/OlstonJW03,Adaptive Filters for Continuous Queries over Distributed Data Streams,"C Olston, J Jiang, J Widom",SIGMOD Conference,2003,291journals/sigmod/LabrinidisR00,Generating Dynamic Content at Database-Backed Web Servers: cgi-bin vs. mod_perl,"A Labrinidis, N Roussopoulos",SIGMOD Record,2000,292journals/sigmod/Palpanas00,Knowledge Discovery in Data Warehouses,T Palpanas,SIGMOD Record,2000,293conf/sigmod/AbiteboulBCMM03,Dynamic XML documents with distribution and replication,"S Abiteboul, A Bonifati, G Cobena, I Manolescu, T Milo",SIGMOD Conference,2003,294journals/sigmod/Franklin00,Editor's Notes,M Franklin,SIGMOD Record,2000,295conf/sigmod/BabcockCD03,Dynamic Sample Selection for Approximate Query Processing,"B Babcock, S Chaudhuri, G Das",SIGMOD Conference,2003,296conf/sigmod/ShenNSHS03,CMVF: A Novel Dimension Reduction Scheme for Efficient Indexing in A Large Image Database,"J Shen, A Ngu, J Shepherd, D Huynh, Q Sheng",SIGMOD Conference,2003,297journals/sigmod/WestmannKHM00,The Implementation and Performance of Compressed Databases,"T Westmann, D Kossmann, S Helmer, G Moerkotte",SIGMOD Record,2000,298conf/sigmod/BornhovdAKMPR03,DBCache: Middle-tier Database Caching for Highly Scalable e-Business Architectures,"C Bornhövd, M Altinel, S Krishnamurthy, C Mohan, H Pirahesh, B Reinwald",SIGMOD Conference,2003,299journals/sigmod/VetterliVS00,Metadata Standards for Data Warehousing: Open Information Model vs. Common Warehouse Metamodel,"T Vetterli, A Vaduva, M Staudt",SIGMOD Record,2000,300conf/sigmod/DeHaanTCO03,A Comprehensive XQuery to SQL Translation using Dynamic Interval Encoding,"D DeHaan, D Toman, M Consens, M Özsu",SIGMOD Conference,2003,301journals/sigmod/ClementiniF00,Spatial Operators,"E Clementini, P Felice",SIGMOD Record,2000,302journals/sigmod/RossAKSSY00,Reminiscences on Influential Papers,N/A,N/A,2000,303conf/sigmod/CranorJSS03,Gigascope: A Stream Database for Network Applications,"C Cranor, T Johnson, O Spatscheck, V Shkapenyuk",SIGMOD Conference,2003,304conf/sigmod/Bierman03,Formal semantics and analysis of object queries,G Bierman,SIGMOD Conference,2003,305journals/sigmod/WuY00,Report on Second International Workshop on Advanced Issues of E-Commerce and Web-based Information Systems,N/A,N/A,2000,306journals/sigmod/ArpinarD00,Provision of Market Services for eCo Compliant Electronic Market Places,"S Arpinar, A Dogac",SIGMOD Record,2000,307conf/sigmod/SunAA03,Hardware Acceleration for Spatial Selections and Joins,"C Sun, D Agrawal, A Abbadi",SIGMOD Conference,2003,308conf/sigmod/ReissK03,A Characterization of the Sensitivity of Query Optimization to Storage Access Cost Parameters,"F Reiss, T Kanungo",SIGMOD Conference,2003,309journals/sigmod/KantM00,"Workshop on Performance and Architecture of Web Servers (PAWS-2000, held in conjection with SIGMETRICS-2000)",N/A,N/A,2000,310conf/sigmod/LometT03,A Theory of Redo Recovery,"D Lomet, M Tuttle",SIGMOD Conference,2003,311journals/sigmod/LudwigG00,Report in ISDO '00: The CAiSE*00 Workshop on Infrastructures for Dynamic Business-to-Business Service Outsourcinga,N/A,N/A,2000,312journals/sigmod/Cruz00,SIGMOD Digital Symposium Collection (DiSC) Editor's Message,N/A,N/A,2000,313conf/sigmod/DeshpandeNGS03,Cache-and-Query for Wide Area Sensor Databases,"A Deshpande, S Nath, P Gibbons, S Seshan",SIGMOD Conference,2003,314conf/sigmod/LiBKN03,Composing XSL Transformations with XML Publishing Views,"C Li, P Bohannon, H Korth, P Narayan",SIGMOD Conference,2003,315journals/sigmod/Naughton00,SIGMOD'2000 Program Chair's Message,N/A,N/A,2000,316conf/sigmod/PapadiasTFS03,An Optimal and Progressive Algorithm for Skyline Queries,"D Papadias, Y Tao, G Fu, B Seeger",SIGMOD Conference,2003,317journals/sigmod/Mendelzon00,Information Director's Message,N/A,N/A,2000,318journals/sigmod/Ley00,SIGMOD Anthology Editor's Message,N/A,N/A,2000,319conf/sigmod/CuiOTS03,Contorting High Dimensional Data for Efficient Main Memory Processing,"B Cui, B Ooi, J Su, K Tan",SIGMOD Conference,2003,320journals/sigmod/Snodgrass00a,Chair's Message,N/A,N/A,2000,321conf/sigmod/Stonebraker03,Visionary: A Next Generation Visualization System for Databases,M Stonebraker,SIGMOD Conference,2003,322journals/sigmod/LeeC00,Comparative Analysis of Six XML Schema Languages,"D Lee, W Chu",SIGMOD Record,2000,323conf/sigmod/Raghavan03,Extracting and Exploiting Structure in Text Search,P Raghavan,SIGMOD Conference,2003,324journals/sigmod/Hammer00,Treasurer's Message,N/A,N/A,2000,325conf/sigmod/Seshadri03,Building Notification Services with Microsoft SQLServer,P Seshadri,SIGMOD Conference,2003,326journals/sigmod/Ozsoyoglu00,Vice Chair's Message,N/A,N/A,2000,327conf/sigmod/Shivakumar03,Google in a Box - Building the Google Search Appliance,N Shivakumar,SIGMOD Conference,2003,328conf/sigmod/Zeller03,NonStop SQL/MX Publish/Subscribe: Continuous Data Streams in Transaction Processing,H Zeller,SIGMOD Conference,2003,329journals/sigmod/Franklin00a,Editor's Notes,M Franklin,SIGMOD Record,2000,330conf/sigmod/Colliat03,Data Management Challenges in CRM,G Colliat,SIGMOD Conference,2003,331journals/sigmod/PoessF00,New TPC Benchmarks for Decision Support and Web Commerce,"M Pöss, C Floyd",SIGMOD Record,2000,332conf/sigmod/GotoK03,Integration of Electronic Tickets and Personal Guide System for Public Transport using Mobile Terminals,"K Goto, Y Kambayashi",SIGMOD Conference,2003,333journals/sigmod/Bussche00,Constraint databases: A tutorial introduction,J Bussche,SIGMOD Record,2000,334conf/sigmod/PadmanabhanBMCH03,Multi-Dimensional Clustering: A New Data Layout Scheme in DB2,"S Padmanabhan, B Bhattacharjee, T Malkemus, L Cranston, M Huras",SIGMOD Conference,2003,335journals/sigmod/TheodoridisN00,Generating Spatiotemporal Datasets on the WWW,"Y Theodoridis, M Nascimento",SIGMOD Record,2000,336journals/sigmod/Halevy00,Theory of Answering Queries Using Views,A Halevy,SIGMOD Record,2000,337conf/sigmod/KriegelBKPS03,Using Sets of Feature Vectors for Similarity Search on Voxelized CAD Objects,"H Kriegel, S Brecheisen, P Kröger, M Pfeifle, M Schubert",SIGMOD Conference,2003,338journals/sigmod/RashidS00,Object Database Evolution Using Separation of Concerns,"A Rashid, P Sawyer",SIGMOD Record,2000,339conf/sigmod/Aggarwal03,A Framework for Change Diagnosis of Data Streams,C Aggarwal,SIGMOD Conference,2003,340conf/sigmod/ChaudhuriKN03,On Relational Support for XML Publishing: Beyond Sorting and Tagging,"S Chaudhuri, R Kaushik, J Naughton",SIGMOD Conference,2003,341journals/sigmod/Jhingran00,Moving up the food chain: Supporting E-Commerce Applications on Databases,A Jhingran,SIGMOD Record,2000,342journals/sigmod/RossIJP00,Reminiscences on Influential Papers,N/A,N/A,2000,343conf/sigmod/KimC03,Qcluster: Relevance Feedback Using Adaptive Clustering for Content-Based Image Retrieval,"D Kim, C Chung",SIGMOD Conference,2003,344conf/sigmod/Krishnamurthy03,Oracle XML DB Repository,V Krishnamurthy,SIGMOD Conference,2003,345journals/sigmod/CasatiDS00,VLDB Workshop on Technologies in E-Services (TES),N/A,N/A,2000,346journals/sigmod/Snodgrass00c,SIGMOD Program Review,N/A,N/A,2000,347conf/sigmod/Pruscino03,Oracle RAC: Architecture and Performance,A Pruscino,SIGMOD Conference,2003,348conf/sigmod/Bosworth03,The Future of Web Services - I,A Bosworth,SIGMOD Conference,2003,349journals/sigmod/PossasMCR00,Using Quantitative Information for Efficient Association Rule Generation,"B Pôssas, W Jr., M Carvalho, R Resende",SIGMOD Record,2000,350conf/sigmod/Cabrera03,The Future of Web services - II,F Cabrera,SIGMOD Conference,2003,351journals/sigmod/HasselbringHHKRRS00,"Research and Practice in Federated Information Systems, Report of the EFIS '2000 International Workshop",N/A,N/A,2000,352conf/sigmod/GangulyGR03,Processing Set Expressions over Continuous Update Streams,"S Ganguly, M Garofalakis, R Rastogi",SIGMOD Conference,2003,353journals/sigmod/Franklin00b,Editor's Notes,M Franklin,SIGMOD Record,2000,354journals/sigmod/YuenCLL00,Cache Invalidation Scheme for Mobile Computing Systems with Real-time Data,"J Yuen, E Chan, K Lam, H Leung",SIGMOD Record,2000,355conf/sigmod/ChaudhuriGGM03,Robust and Efficient Fuzzy Match for Online Data Cleaning,"S Chaudhuri, K Ganjam, V Ganti, R Motwani",SIGMOD Conference,2003,356conf/sigmod/KementsietsidisAM03,Mapping Data in Peer-to-Peer Systems: Semantics and Algorithmic Issues,"A Kementsietsidis, M Arenas, R Miller",SIGMOD Conference,2003,357journals/sigmod/BernsteinHP00,A Vision of Management of Complex Models,"P Bernstein, A Halevy, R Pottinger",SIGMOD Record,2000,358conf/sigmod/StoltePAG03,Scientific Data Repositories: Designing for a Moving Target,"E Stolte, C Praun, G Alonso, T Gross",SIGMOD Conference,2003,359journals/sigmod/Snodgrass00b,Chair's Message,N/A,N/A,2000,360conf/sigmod/GuptaS03,Stream Processing of XPath Queries with Predicates,"A Gupta, D Suciu",SIGMOD Conference,2003,361journals/sigmod/CarmelMS01,XML and Information Retrieval: a SIGIR 2000 Workshop,N/A,N/A,2001,362journals/sigmod/BoscMP01,Report on The fourth International Conference on Flexible Query Answering systems,N/A,N/A,2001,363conf/sigmod/PengC03,XPath Queries on Streaming Data,"F Peng, S Chawathe",SIGMOD Conference,2003,364conf/sigmod/ZhangZPTL03,Location-based Spatial Queries,"J Zhang, M Zhu, D Papadias, Y Tao, D Lee",SIGMOD Conference,2003,365journals/sigmod/MeltonMJKSZ01,SQL and Management of External Data,"J Melton, J Michels, V Josifovski, K Kulkarni, P Schwarz, K Zeidenstein",SIGMOD Record,2001,366journals/sigmod/MillerHHYHFP01,The Clio Project: Managing Heterogeneity,"R Miller, M Hernández, L Haas, L Yan, C Ho, R Fagin, L Popa",SIGMOD Record,2001,367conf/sigmod/MaddenFHH03,The Design of an Acquisitional Query Processor For Sensor Networks,"S Madden, M Franklin, J Hellerstein, W Hong",SIGMOD Conference,2003,368conf/sigmod/MinPC03,XPRESS: A Queriable Compression for XML Data,"J Min, M Park, C Chung",SIGMOD Conference,2003,369journals/sigmod/BertinoEH01,Quality of Service in Multimedia Digital Libraries,"E Bertino, A Elmagarmid, M Hacid",SIGMOD Record,2001,370conf/sigmod/QunLO03,D(k)-Index: An Adaptive Structural Summary for Graph-Structured Data,"C Qun, A Lim, K Ong",SIGMOD Conference,2003,371journals/sigmod/FengJH01,Towards Knowledge-Based Digital Libraries,"L Feng, M Jeusfeld, J Hoppenbrouwers",SIGMOD Record,2001,372conf/sigmod/Dyreson03,"Temporal Coalescing with Now, Granularity, and Incomplete Information",C Dyreson,SIGMOD Conference,2003,373journals/sigmod/RossCGLLM01,Reminiscences on Influential Papers,N/A,N/A,2001,374journals/sigmod/Critchlow01,Report on XEWA-00: The XML Enabled Wide-Area Searches for Bioinformatics Workshop,N/A,N/A,2001,375conf/sigmod/ZhuS03,Warping Indexes with Envelope Transforms for Query by Humming,"Y Zhu, D Shasha",SIGMOD Conference,2003,376journals/sigmod/Snodgrass01,Chair's Message,N/A,N/A,2001,377conf/sigmod/MelnikRB03,Rondo: A Programming Platform for Generic Model Management,"S Melnik, E Rahm, P Bernstein",SIGMOD Conference,2003,378conf/sigmod/KangN03,On Schema Matching with Opaque Column Names and Data Values,"J Kang, J Naughton",SIGMOD Conference,2003,379journals/sigmod/Aggarwal01,Re-designing Distance Functions and Distance-Based Applications for High Dimensional Data,C Aggarwal,SIGMOD Record,2001,380conf/sigmod/HeC03,Statistical Schema Matching across Web Query Interfaces,"B He, K Chang",SIGMOD Conference,2003,381journals/sigmod/LawderK01,Querying Multi-dimensional Data Indexed Using the Hilbert Space-filling Curve,"J Lawder, P King",SIGMOD Record,2001,382conf/sigmod/CohenM03,Spectral Bloom Filters,"S Cohen, Y Matias",SIGMOD Conference,2003,383journals/sigmod/PuSW01,Infosphere Project: System Support for Information Flow Applications,"C Pu, K Schwan, J Walpole",SIGMOD Record,2001,384journals/sigmod/BernsteinBCDFGGHHJLMNPSU98,The Asilomar Report on Database Research,"P Bernstein, M Brodie, S Ceri, D DeWitt, M Franklin, H Garcia-Molina, J Gray, G Held, J Hellerstein, H Jagadish, M Lesk, D Maier, J Naughton, H Pirahesh, M Stonebraker, J Ullman",SIGMOD Record,1998,385conf/sigmod/LuoEHN02,A scalable hash ripple join algorithm,"G Luo, C Ellmann, P Haas, J Naughton",SIGMOD Conference,2002,386conf/sigmod/HacigumusILM02,Executing SQL over encrypted data in the database-service-provider model,"H Hacigümüs, B Iyer, C Li, S Mehrotra",SIGMOD Conference,2002,387journals/sigmod/ChristoffelPSL98,Electronic Market: The Roadmap for University Libraries and Members to Survive in the Information Jungle,"M Christoffel, S Pulkowski, B Schmitt, P Lockemann",SIGMOD Record,1998,388conf/sigmod/KaushikBNK02,Covering indexes for branching path queries,"R Kaushik, P Bohannon, J Naughton, H Korth",SIGMOD Conference,2002,389journals/sigmod/MeltzerC98,XML and Electronic Commerce: Enabling the Network Economy,"B Meltzer, R Glushko",SIGMOD Record,1998,390conf/sigmod/ChungMS02,APEX: an adaptive path index for XML data,"C Chung, J Min, K Shim",SIGMOD Conference,2002,391journals/sigmod/BichlerSZ98,Component-based E-Commerce: Assesment of Current Practices and Future Directions,"M Bichler, A Segev, J Zhao",SIGMOD Record,1998,392conf/sigmod/Grust02,Accelerating XPath location steps,T Grust,SIGMOD Conference,2002,393journals/sigmod/Franklin98a,Editor's Notes,M Franklin,SIGMOD Record,1998,394conf/sigmod/ZadorozhnyRVUB02,Efficient evaluation of queries in a mediator for WebSources,"V Zadorozhny, L Raschid, M Vidal, T Urhan, L Bright",SIGMOD Conference,2002,395journals/sigmod/EisenbergM98a,"SQLJ Part 0, Now Known as SQL/OLB (Object-Language Bindings)","A Eisenberg, J Melton",SIGMOD Record,1998,396journals/sigmod/Ritter98,The Middleware Muddle,D Ritter,SIGMOD Record,1998,397conf/sigmod/OlstonW02,Best-effort cache synchronization with source cooperation,"C Olston, J Widom",SIGMOD Conference,2002,398journals/sigmod/SnodgrassHMOPRRWY98,Reminiscences on Influential Papers,N/A,N/A,1998,399conf/sigmod/MaddenSHR02,Continuously adaptive continuous queries over streams,"S Madden, M Shah, J Hellerstein, V Raman",SIGMOD Conference,2002,400conf/sigmod/KalnisNOPT02,An adaptive peer-to-peer network for distributed caching of OLAP results,"P Kalnis, W Ng, B Ooi, D Papadias, K Tan",SIGMOD Conference,2002,401journals/sigmod/BollKB98,Design and Implementation of RMP - A Virtual Electronic Market Place,"S Boll, W Klas, B Battaglin",SIGMOD Record,1998,402journals/sigmod/ReichB98,A Componentized Architecture for Dynamic Electronic Markets,"B Reich, I Ben-Shaul",SIGMOD Record,1998,403conf/sigmod/RiedewaldAA02,Efficient integration and aggregation of historical information,"M Riedewald, D Agrawal, A Abbadi",SIGMOD Conference,2002,404conf/sigmod/BunemanKTT02,Archiving scientific data,"P Buneman, S Khanna, K Tajima, W Tan",SIGMOD Conference,2002,405journals/sigmod/JenningsNF98,ADEPT: An Agent-Based Approach to Business Process Management,"N Jennings, T Norman, P Faratin",SIGMOD Record,1998,406conf/sigmod/Chamberlin03,XQuery: A Query Language for XML,N/A,N/A,2003,407journals/sigmod/DogacDATKCD98,A Workflow-based Electronic Marketplace on the Web,"A Dogac, I Durusoy, S Arpinar, N Tatbul, P Koksal, I Cingil, N Dimililer",SIGMOD Record,1998,408journals/sigmod/Dogac98,Guest Editor's Introduction,N/A,N/A,1998,409conf/sigmod/GraySSU03,The Lowell Report,"J Gray, H Schek, M Stonebraker, J Ullman",SIGMOD Conference,2003,410journals/sigmod/Snodgrass98c,Chair's Message,N/A,N/A,1998,411conf/sigmod/KoudasS03,Panel: Querying Networked Databases,"N Koudas, D Srivastava",SIGMOD Conference,2003,412conf/sigmod/KornMZ03,IPSOFACTO: A Visual Correlation Tool for Aggregate Network Traffic Data,"F Korn, S Muthukrishnan, Y Zhu",SIGMOD Conference,2003,413journals/sigmod/Domingo-FerrerH98,An Anonymous Electronic Commerce Scheme with an Off-Line Authority and Untrusted Agents,"J Domingo-Ferrer, J Herrera-Joancomartí",SIGMOD Record,1998,414journals/sigmod/BuchnerM98,Discovering Internet Marketing Intelligence through Online Analytical Web Usage Mining,"A Büchner, M Mulvenna",SIGMOD Record,1998,415conf/sigmod/SengarH03,PLASTIC: Reducing Query Optimization Overheads through Plan Recycling,"V Sengar, J Haritsa",SIGMOD Conference,2003,416